{
  "name": "אורי שקד",
  "github": "urish",
  "twitter": "https://twitter.com/UriShaked",
  "website": "https://urish.org/",
  "description": "אוהב לבנות פרוייקטים שמשלבים חומרה ותוכנה, למשל גרסה אמיתית של המשחק עם הדינוזאור מכרום. עובד על Wokwi, פלטפורמה לסימולציה של ארדואינו שרצה בדפדפן, וחלק מהצוות של Pull Request. מעצב דברים שימושיים לבית ומדפיס בתלת מימד. רקדן ומדריך סלסה ובעבר ניהלתי עם חברים את מועדון Salsa4Fun, שם גם הכרתי את אשתי. מנגן על חליל פאן. 🎶",
  "roles": ["Admin","Mentor"]
}
