{
    "name": "הגר שילה",
    "github": "strayblues",
    "linkedin": "https://www.linkedin.com/in/hagar-shilo-04651511b",
    "website": "https://blog.hagarsh.com",
    "description": "בוגרת Google Summer of Code (התמחות קיץ בקוד פתוח) וכיום מפתחת פרונטאנד עצמאית. אוהבת לבנות פרויקטים אישיים, לומדת בלשנות קוגניטיבית, חובבת תפירה וכותבת בלוג טכנולוגי בנושא הסבה לפיתוח."
}
