{
  "name": "גיא יפה",
  "github": "guyyaffear",
  "linkedin": "https://www.linkedin.com/in/guy-yaffe-ermoza/",
  "description": "עשיתי הסבה מקריירה בטחונית בוטקאמפ 8 חודשים בColumbia University עובד כמפתח פרונט כימעט שלוש שנים ועושה תואר במדעי המחשב  תוך כדי אוהב מאוד מרוואל I AM GROOT אוסף פואפים כמובן רק של מרוואל אוהב לגלוש סנובורד וספורט לאכול פיצה  וכמובן LOL ולהנות "
}
