{
    "name": "יובל אבולעפיה",
    "github": "yuvalabou",
    "facebook": "https://www.facebook.com/yuval.abou/",
    "linkedin": "https://www.linkedin.com/in/yuvalaboudesign/",
    "description": "מעצב תעשייתי בהכשרתי ומייקר בנשמתי, אוהב ללמוד ולהתקדם בכל תחום שאני מוצא כמאתגר. כך הגעתי ללמוד קוד וגיטהב הפך לדף הבית שלי."
}
