{
  "name": "ברק ברודו",
  "github": "MrBLightning",
  "facebook": "https://www.facebook.com/barak.brudo/",
  "twitter": "https://twitter.com/BarakBrudo",
  "linkedin": "https://www.linkedin.com/in/barakbrudo/",
  "description": "בעבר מפתח Fullstack וכיום DevRel. התואר שלי בכלל בהוראת אמנות עם התמחות בצילום. עבדתי כמעצב גרפי ✨, עוזר צלם ⚡ ומדריך אמנויות לחימה 💪. אוהב לשיר ולהריץ משחקי מבוכים ודרקונים."
}
