{
  "name": "אולגה שבקו",
  "github": "shebeolga",
  "facebook": "https://www.facebook.com/olga.shebeko.5/",
  "linkedin": "https://www.linkedin.com/in/shebeolga/",
  "website": "https://shebeolga.medium.com/",
  "description": "אני מתכנתת חשדה. אהובת לפתור בעיור ולעשות דברים טובים ונחמדים. מקווה, שאוכל לעשות משהו משמעותי ושימושי"
}
