{
    "name": "ינאי אדרי",
    "github": "yanai101",
    "facebook": "https://www.facebook.com/yanai.edri",
    "twitter": "https://twitter.com/yanaiEdri",
    "linkedin": "https://www.linkedin.com/in/yanaiedri/",
    "description": "מפתח למעלה מעשות וחצי כיום בסייבראק , ממייסדי קהילת המפתחים הגדולה של הדרום (Negev Web Developers) כותב מאמרים כשנתקל בנושאים מעניינים , מאמין גדול בתרומה לקהילת המפתחים ,מתחזק ערוץ טלגרם המעדכן מניוזלטרים שונים, נשוי +5 , בהכשרתי פראמדיק"
  }
