{
  "name": "הילה פיש",
  "github": "hilafish",
  "facebook": "https://www.facebook.com/hila.fish",
  "twitter": "https://twitter.com/Hilafish1",
  "linkedin": "https://www.linkedin.com/in/hila-fish",
  "website": "https://medium.com/@hilafish",
  "description": "אני עובדת כ- Senior DevOps Engineer, התרומה שלי לפרויקטי קוד פתוח כרגע היא בעיקר בהטמעתם בסביבות השונות בעבודה, כתיבת בלוג פוסטים על יוז קייסים של הטמעת כלי קוד פתוח וכן הפצת הבשורה בכנסים (כמרצה וכאורחת). מעבר לזה, אני סולנית בהרכב קאברים, מנהלת תוכנית בקהילת ״באות״ וחלק ממארגני כנסי DevOpsDays TLV ו-StatsCraft.",
  "roles": ["admin"]
}
