{
  "name": "ישי מנדלסון",
  "github": "myishay",
  "facebook": "https://www.facebook.com/myishay",
  "linkedin": "https://www.linkedin.com/in/yishay-mendelsohn-174493133/",
  "description": "מפתח בחברה datree.io ומנחה את הפודקאסט קוד פתוח יחד עם דימה ברוסילובסקי",
  "website": "https://openkodpod.com/"
}
