{
  "name": "אדיר סלוצקי",
  "github": "Adir-SL",
  "facebook": "https://www.facebook.com/slutzkis",
  "linkedin": "https://www.linkedin.com/in/adir-slutzki-1686189",
  "twitter": "https://twitter.com/adircode",
  "description": "מעצב UI/UX ומאסטר ב-CSS מרצה במכללות ברחבי הארץ ומכין שקשוקה מעולה, אוהב לעשות אנימציות ופרויקטים אישיים."
}