{
  "name": "עמית ברלץ",
  "github": "abrl91",
  "linkedin": "https://www.linkedin.com/in/amitbarletz/",
  "website": "https://syntactic-sugar.netlify.app/",
  "twitter": "https://twitter.com/BarletzA52",
  "description": "מפתחת FrontEnd בחברה שנקראת PROFTIT. אוהבת לקרוא ספרים על פסיכולוגיה חיובית, לומדת לנגן על פסנתר, מכורה לריצה ולספורט באופן כללי. מנהלת יחד עם עוז, אורי ומיכל את Pull Request",
  "roles": ["Former admin"]
}
