{
    "name": "יניב ויינשטיין",
    "github": "YanivWein24",
    "linkedin": "https://www.linkedin.com/in/yaniv-weinshtein/",
    "website": "https://yaniv-portfolio.netlify.app/",
    "description": "הנדסאי אלקטרוניקה ומפתח פולסטאק אוטודידקט, מתמחה ב MERN Stack. בזמן המועט שבו אני לא על המחשב כנראה שתמצאו אותי בסוני. "
}
