{
    "name": "שיר זבולוטני",
    "github": "shir0206",
    "facebook": "https://www.facebook.com/shir.klein.5",
    "linkedin": "https://www.linkedin.com/in/shir-zabolotny-a83b18109/",
    "website": "https://shir0206.github.io/ShirWeb/",
    "description": "אני שיר, מפתחת Front End שאוהבת גם ציורים גם טיולים וגם טיפול בצמחים!"
  }
  