{
  "name": "דני סופר",
  "github": "soferdani",
  "facebook": "https://www.facebook.com/soferdani",
  "twitter": "https://twitter.com/SoferDani",
  "linkedin": "https://www.linkedin.com/in/dani-sofer/",
  "description": "חיה עסקית עם אהבה לטכנולוגיה וקוד, מפתח פוולסטאק שמחפש אתרגים בהם אוכל להשפיע כמה שיותר. אני גם מנגן ביוקולהלה, גולש גלים, אוהב קפה ושחמט  "
}