{
    "name": "משה וילנר",
    "github": "shootermv",
    "facebook": "https://www.facebook.com/moshe.vilner/",
    "twitter": "https://twitter.com/shootermv",
    "linkedin": "https://www.linkedin.com/in/moshe-vilner-7a7745a/",
    "website": "https://gs500coder.blogspot.com",
    "description": "אבא ,לשעבר תלמיד ישיבה, לשעבר פיאונר ממוסקוה. אדם מוזר וקצת מטורף שמנסה נואשות להפוך את עצמו למתכנת מצליח ואגדי. לך תדע, אולי יום אחד זה יצליח למרבה האירוניה"
}
