{
  "name": "לירן טל",
  "github": "lirantal",
  "facebook": "https://www.facebook.com/tliran",
  "twitter": "https://twitter.com/liran_tal",
  "linkedin": "https://www.linkedin.com/in/talliran/",
  "website": "https://lirantal.medium.com/",
  "description": "אני אוהב לקחת חלק בקהילות, פרויקטי קוד פתוח, ובאופן פרטני יותר בקהילות של נוד וג׳אווהסקריפט. רוב הזמן אני מתעסק במחקר של אבטחת תוכנה, ופעילויות העלאת המודעות לאבטחת קוד פתוח. אוהב כדורגל, לנגן, משחקי סימולציות טיסה, ולבנות כלים לשורת פקודה.",
  "roles": [""]
}
