{
  "name": "אלדד פוקס",
  "github": "eldadfux",
  "facebook": "https://www.facebook.com/eldad.fux/",
  "twitter": "https://twitter.com/eldadfux",
  "linkedin": "https://www.linkedin.com/in/eldadfux/",
  "website": "https://appwrite.io",
  "description": "יזם, ארכיטקט תוכנה, אובססיבי על כל מה שקשור לקוד פתוח והיוצר של appwrite.io",
  "roles": ["Mentor"]
}
