{
  "name": "סיאור מאיר",
  "github": "https://github.com/siorm2310",
  "facebook": "https://www.facebook.com/sior.meir",
  "linkedin": "https://www.linkedin.com/in/sior-meir",
  "description": "מהנדסה אווירונאוטיקה ומפתח תוכנה, חובב שפות (גם של בני אדם וגם של מחשבים) אך מתמקד כיום בפייתון, גיימר וחובב מחשבים מגיל צעיר",
  "roles": ["Developer"]
}
