{
    "name": "אנה דינבורג ווליך",
    "github": "AnnaDinaburgVulikh",
    "facebook": "https://www.facebook.com/dinaburg/",
    "twitter": "https://twitter.com/AnnaDinVu",
    "linkedin": "https://www.linkedin.com/in/anna-dinaburg-vulikh/",
    "description": "מהנדסת תעשייה וניהול, בתהליך הסבה לתחום התכנות. מתנדבת בשיקודס, סיימתי מסלול פייתון בארגון. אוהבת את כל סרטי מרוול וגם הסדרות ."
  }