{
    "name": "תומר בריסקר",
    "github": "tbrisker",
    "facebook": "https://www.facebook.com/tomer.brisker/",
    "twitter": "https://twitter.com/tbrisker_pro",
    "linkedin": "https://www.linkedin.com/in/tbrisker/",
    "description": "כותב קוד פתוח מאז 1999, לפעמים גם מקבל על זה כסף. אוהב גם לאכול אוכל טוב, לשתות בירה, להרצות בכנסים ולטוס בעולם שאין בו מגפות, ובמיוחד לשלב הכל יחד."
}
