{
  "name": "אדיר קנדל",
  "github": "adirkandel",
  "facebook": "https://www.facebook.com/adirkandel/",
  "linkedin": "https://www.linkedin.com/in/adir-kandel/",
  "description": "Full stack ביכולות אבל Front end developer בלב ❤️. אני לא גזען פשוט מאוהב ב- Vue. מנהל את הערוץ והבלוג של FED Cast IL.",
  "website": "https://fedcast.co.il"
}
