{
  "name": "אנה הינו",
  "github": "angardia",
  "facebook": "https://www.facebook.com/anna.hino",
  "twitter": "https://twitter.com/Angardia",
  "linkedin": "https://www.linkedin.com/in/anna-hino-0838a7198/",
  "website": "https://codepen.io/angardia",
  "description": "מעריצת חתולים מושבעת, גיימרית, מחפשת משרת FRONT END ראשונה, מציירת בCSS ואוהבת בירות!!!"
} 
