{
  "name": "אבנר רוסלר",
  "github": "avnerussler",
  "facebook": "https://www.facebook.com/AvneRussler/",
  "twitter": "https://twitter.com/AvneRussler",
  "linkedin": "https://www.linkedin.com/in/avnerussler/",
  "website": "https://portfolio-rose-iota.vercel.app/",
  "description": "משרת בצה״ל, חרדי לשעבר, כאן בשביל ללמוד להתפתח ולתרום"
}
