{
    "name": "ארז הוד",
    "github": "erezhod",
    "facebook": "https://www.facebook.com/erezhod",
    "twitter": "https://twitter.com/ErezHod",
    "linkedin": "https://www.linkedin.com/in/erezhod",
    "website": "https://erezhod.com",
    "description": "מייסד ומנכ\"ל חברת Hero Apps, Ltd. מפתח Full-Stack ב-Angular, Node, SQL וגם נייטיב מובייל ל-iOS/iPadOS. בזמני הפנוי אני אוהב לגיימר (יותר מדי World of Warcraft), לנהוג ברכבי ספורט, לשמוע Metal בווליום גבוהה במיוחד ולצפות בכמה שיותר סדרות אנימה."
}
